[{"title":"Instant Pot Short Ribs","description":"Beef short ribs braised with red wine, stock and aromatics until tender, then served with a glossy pan gravy.","course":"Main Course","cuisine":"American","servings":"4","prep_time":"10 min","cook_time":"45 min","total_time":"85 min","ingredient_groups":[{"name":"","items":["1 tablespoon extra virgin olive oil (+ more if needed)","8 bone-in short ribs","kosher salt and pepper","1 large yellow onion (chopped)","2 large carrots (peeled and chopped)","2 ribs celery (chopped)","2 tablespoons minced garlic","½ cup dry red wine (see note)","1 cup low-sodium beef broth","2 sprigs fresh thyme","1 dried bay leaf","2 tablespoons balsamic vinegar","1 tablespoon brown sugar","1 tablespoon reduced-sodium soy sauce (or Tamari)","2 tablespoons cornstarch (or arrowroot powder)","3 tablespoons cold water","1-2 tablespoons unsalted butter (optional)"]}],"step_groups":[{"name":"Method","steps":["Select sauté on the Instant Pot. Add 1 tablespoon extra virgin olive oil and warm it briefly while seasoning the ribs.","Apply a generous salt-and-pepper coating to every face of each rib. Working with half at a time, sear the ribs in the hot oil for about 4-5 minutes on each side. Transfer the browned batch to a plate, then repeat with the rest, adding oil only if the pot is dry.","Put the onion, carrots and celery into the pot and cook for 3-4 minutes, until softened. Stir in 2 tablespoons minced garlic and cook for about 30 seconds.","Add ½ cup dry red wine, or the same amount of extra stock, and scrape the base thoroughly. Simmer for 1 minute, then cancel sauté.","Stir in 1 cup beef broth, 2 tablespoons balsamic vinegar, 1 tablespoon brown sugar, 1 tablespoon soy sauce, 2 thyme sprigs and 1 bay leaf. Return the ribs and settle them evenly into the liquid.","Lock the lid, set the valve to sealing and cook on high pressure for 45 minutes.","Leave the pressure to release naturally for at least 15 minutes before opening.","Move the ribs to a plate and cover loosely with foil. Bring the liquid to a lively simmer on sauté. Whisk together 2 tablespoons cornstarch and 3 tablespoons cold water, then gradually whisk this slurry into the pot. Continue whisking for 2-4 minutes, until thickened. For a richer finish, melt in 1-2 tablespoons unsalted butter, then cancel sauté.","Spoon the gravy over the short ribs to serve."]}],"notes":["A dry red wine gives the gravy depth; use extra beef broth for an alcohol-free version."],"nutrition":"Calories: 529 kcal · Carbs: 19 g · Protein: 46 g · Fat: 27 g · Sodium: 419 mg · Fiber: 2 g · Sugar: 8 g","keywords":["beef","short ribs","red wine","gravy","braised","comfort food"],"slug":"instant-pot-short-ribs","category":"Beef","rating":5.0,"rating_count":57,"source_name":"amindfullmom.com","source_url":"https://amindfullmom.com/instant-pot-short-ribs/","source_id":"61f0c1f05e23846755e83b68","schema_version":1,"quality_tier":"standard"},{"title":"Instant Pot Lasagna","description":"A compact layered lasagna with meat sauce, seasoned ricotta, mozzarella and tender pasta, cooked in a pan above the water.","course":"Main Course","cuisine":"Italian","servings":"6","prep_time":"10 min","cook_time":"22 min","total_time":"32 min","ingredient_groups":[{"name":"","items":["2 teaspoons olive oil","½ pound ground beef or ground Italian sausage","½ medium yellow onion (chopped)","2 teaspoons Italian seasoning (divided)","1 teaspoon minced garlic","½ teaspoon kosher salt","16 ounces ricotta cheese","¼ teaspoon crushed red pepper flakes (optional)","1 large egg","½ teaspoon garlic powder","⅓ cup parmesan cheese (freshly grated)","6-8 no-boil or oven ready lasagna noodles","3 cups spaghetti sauce","2 cups shredded Mozzarella Cheese (divided)","1-1/2 cups water (for pressure cooking)"]}],"step_groups":[{"name":"Method","steps":["For a meat lasagna, select sauté, warm 2 teaspoons olive oil and add the ground meat, onion, 1 teaspoon Italian seasoning, 1 teaspoon minced garlic and 1/2 teaspoon kosher salt. Break up the meat and cook until fully browned.","Cancel sauté, lift the cooked meat mixture out of the pot and reserve it for layering.","Add 1-1/2 cups water to the inner pot and scrape away every browned spot. Set the trivet over the water.","Mix the ricotta, egg, 1 teaspoon Italian seasoning, 1/2 teaspoon garlic powder, 1/4 teaspoon red-pepper flakes and 1/3 cup Parmesan in a bowl.","Coat the base of a 7 by 3-inch springform or oven-safe cake pan with a little sauce. Break noodles to cover the base, then layer half the ricotta, half the meat, sauce and a light scattering of mozzarella. Repeat with noodles, the remaining ricotta and meat, more sauce and mozzarella. Finish with noodles, a generous sauce layer and the remaining cheese in the same 7 by 3-inch pan.","Make a foil sling beneath the pan, lower it onto the trivet and cover the top loosely with foil.","Seal the cooker and cook on high pressure for 27 minutes.","At the end of cooking, wait at least 10 minutes before releasing the remaining pressure quickly.","For a browned top, transfer the uncovered pan to a tray and broil for 3-6 minutes, watching closely. Alternatively, fit an air-fryer lid at 360°F for 3 to 5 minutes.","Rest the lasagna in its pan for 10 minutes before releasing the sides, slicing and serving."]}],"notes":["The foil sling makes the hot lasagna pan safer to lift from the cooker."],"nutrition":"Calories: 442 kcal · Carbs: 36 g · Protein: 29 g · Fat: 18 g · Sodium: 1279 mg · Fiber: 3 g · Sugar: 9 g","keywords":["lasagna","pasta","ricotta","mozzarella","italian","family dinner"],"slug":"instant-pot-lasagna","category":"Pasta & Grains","rating":4.77,"rating_count":55,"source_name":"amindfullmom.com","source_url":"https://amindfullmom.com/instant-pot-lasagna/","source_id":"3f5f80281d4eb2c7c4d1120e","schema_version":1,"quality_tier":"standard"},{"title":"Instant Pot French Dip","description":"Tender shredded chuck, sweet onions and melted Swiss cheese served in crusty bread with concentrated beef jus for dipping.","course":"Dinner","cuisine":"American","servings":"6","prep_time":"","cook_time":"","total_time":"110 min","ingredient_groups":[{"name":"","items":["2 - 3 pounds (965g) USDA choice grade chuck roast/Canada AAA grade blade roast (, 2 - 2.5 inches thick)","6 (18g) cloves garlic (, minced)","3 (673g) onions (, sliced)","1 cup (250ml) unsalted chicken stock or high quality beef stock","1 tablespoon (15ml) regular soy sauce","1 tablespoon (15ml) fish sauce ((can substitute with regular soy sauce))","1 tablespoon (15ml) Worcestershire sauce","1 tablespoon (15ml) olive oil","1 pinch dried rosemary","1 pinch thyme","2 bay leaves","1 loaf french bread","2 - 3 slices Swiss cheese"]}],"step_groups":[{"name":"Method","steps":["Heat the cooker on Sauté More until HOT, about 8 mins. Pat the chuck dry, season the first face with salt and pepper and add 1 tbsp olive oil. Lay the seasoned face down, season the upper face and brown each side for 10 minutes. Skip browning only if using a dump-and-cook approach.","Transfer the roast out. Cook the sliced onions for 3 - 4 mins, then reserve roughly ⅓ of them. Add the garlic, rosemary, thyme and 2 bay leaves; stir for another minute. If sauté switches off after 30 minutes, turn it on again.","Pour in 1 cup unsalted stock and scrape the base with a wooden spoon until no browned residue remains stuck.","Mix in 1 tbsp (15ml) soy sauce, 1 tbsp (15ml) fish sauce and 1 tbsp (15ml) Worcestershire sauce. Return the chuck and push it partly below the liquid. Cook on high pressure for 45 minutes, followed by a 25-minute natural release.","Move the beef to a bowl and pull it apart with 2 forks. Meanwhile, bring the jus to a boil on sauté, return the reserved onions and reduce for 5 - 10 minutes. Adjust the seasoning and remove excess fat if needed.","If melting the cheese in the oven, heat it to 350°F. Split the 1 loaf of French bread, cover with Swiss cheese and warm until the cheese softens. Add the beef and onions, and serve the hot jus alongside."]}],"notes":["Skim or separate excess fat from the jus before reducing it."],"nutrition":"Calories: 369 kcal · Carbs: 12 g · Protein: 33 g · Fat: 21 g · Sodium: 410 mg · Fiber: 2 g · Sugar: 5 g","keywords":["french dip","beef sandwich","chuck roast","au jus","swiss cheese","onions"],"slug":"instant-pot-french-dip","category":"Mains","rating":4.98,"rating_count":209,"source_name":"www.pressurecookrecipes.com","source_url":"https://www.pressurecookrecipes.com/instant-pot-french-dip/","source_id":"06de6af5efb8c0bbb0a4edf1","schema_version":1,"quality_tier":"standard"},{"title":"Red Lentils Curry (Masoor Dal)","description":"A quick vegan masoor dal of red lentils, tomato, warming spices and lime, with an optional pot-in-pot rice method.","course":"Main Course","cuisine":"Indian","servings":"4","prep_time":"5 min","cook_time":"20 min","total_time":"25 min","ingredient_groups":[{"name":"","items":["1 tablespoon Ghee or Oil","1 teaspoon Cumin seeds (Jeera)","1 Green chili pepper (optional)","1/2 cup Onions (diced)","1/2 tablespoon Garlic (minced)","1/2 tablespoon Ginger (grated)","1 cup Tomatoes (chopped)","1 cup Red lentils (Masoor Dal) (rinsed )","3 cups Water (or reduce to 2.5 cups for a thicker dal)","1 tablespoon Lime juice","Cilantro (to garnish)","1/2 teaspoon Ground Turmeric (Haldi powder)","1/2 teaspoon Coriander powder (Dhaniya powder)","1/2 teaspoon Red Chili powder (Mirchi powder) (adjust to taste, I used mild Kashmiri red chili powder)","1/2 teaspoon Garam Masala (optional )","1 teaspoon Salt (adjust to taste)","1 cup Basmati Rice","1.25 cup Water","1 tablespoon Ghee or Oil","1 teaspoon Salt"]}],"step_groups":[{"name":"Instant Pot","steps":["Heat the cooker on sauté. Add the oil and cumin seeds, and cook for 30 seconds.","Once the cumin darkens slightly, add the green chilli, onion, ginger and garlic. Stir frequently for 3 minutes, until the onion is golden.","Mix in the tomato and spices and continue sautéing for 2 minutes